mysql> # Create Tables: 
mysql> 
mysql> create table student(
    -> sid int, 
    -> did int, 
    -> tid int, sname varchar(20), cgpa int, branch varchar(20), dob date, primary key(tid) );
Query OK, 0 rows affected (0.04 sec)

mysql> 
mysql> create table placements(did int, pname varchar(20), package int, loc varchar(200), primary key(pname));
Query OK, 0 rows affected (0.04 sec)

mysql> 
mysql> create table train(tid int, tcname varchar(20), tfee int, tyear date, foreign key(tid) references student(tid) on delete cascade, foreign key(tcname) references placements(pname) on delete cascade);
Query OK, 0 rows affected (0.06 sec)

mysql> 
mysql> # insert data into tables: 
mysql> Insert into student
    -> (sid, did, tid, sname, cgpa, branch, dob) values 
    -> (1, 1, 1, 'arnav', 9, 'COMP', '2002-12-12'),
    -> (2, 2, 2, 'swaraj', 9, 'COMP', '2002-1-1'),
    -> (3, 3, 3, 'devraj', 8, 'COMP', '2003-1-1'),
    -> (4, 4, 4, 'araj', 8, 'IT', '2003-10-10'),
    -> (5, 5, 5, 'student', 7, 'IT', '2003-10-10'),
    -> (6, 6, 6, 'dyan', 6, 'IT', '2003-10-10'),
    -> (7, 7, 7, 'aurum', 5, 'IT', '2003-10-10'),
    -> (8, 8, 8, 'silica', 6, 'ENTC', '2003-10-10'),
    -> (9, 9, 9, 'dodo', 7, 'ENTC', '2003-10-10'),
    -> (0, 0, 10, 'apple', 8, 'ENTC', '2003-10-10');
Query OK, 10 rows affected (0.01 sec)
Records: 10  Duplicates: 0  Warnings: 0

mysql> 
mysql> 
mysql> insert into placements
    -> (did, pname, package, loc) values 
    -> (1, 'adobe', 30000, 'Pune'),
    -> (2, 'sandbox', 40000, 'Pune'),
    -> (3, 'dropbox', 30000, 'Mumbai'),
    -> (4, 'facebook', 40000, 'Mumbai'),
    -> (5, 'google', 50000, 'Nashik'),
    -> (6, 'haldiram', 606000, 'Nashik');
Query OK, 6 rows affected (0.01 sec)
Records: 6  Duplicates: 0  Warnings: 0

mysql> 
mysql> 
mysql> insert into train
    -> (tid, tcname, tfee, tyear) values
    -> (1, 'adobe', 30000, '2020-10-1'),
    -> (2, 'sandbox', 40000, '2021-1-10'),
    -> (3, 'dropbox', 10000, '2023-10-1'),
    -> (4, 'adobe', 50000, '2026-1-10'),
    -> (5, 'adobe', 70000, '2019-10-1'),
    -> (6, 'dropbox', 70000, '2019-10-1');
Query OK, 6 rows affected (0.11 sec)
Records: 6  Duplicates: 0  Warnings: 0

mysql> 
mysql> # Create view(simple)
mysql> create view data as select  p.pname, s.sname, p.loc, p.package, t.tid from student s, train t, placements p where (s.tid
    -> = t.tid) and (t.tcname = p.pname) order by p.package desc with check option;
Query OK, 0 rows affected (0.03 sec)

mysql> select * from data;
+---------+---------+--------+---------+------+
| pname   | sname   | loc    | package | tid  |
+---------+---------+--------+---------+------+
| sandbox | swaraj  | Pune   |   40000 |    2 |
| adobe   | arnav   | Pune   |   30000 |    1 |
| dropbox | devraj  | Mumbai |   30000 |    3 |
| adobe   | araj    | Pune   |   30000 |    4 |
| adobe   | student | Pune   |   30000 |    5 |
| dropbox | dyan    | Mumbai |   30000 |    6 |
+---------+---------+--------+---------+------+
6 rows in set (0.00 sec)

mysql> # Create Index:
mysql> 
mysql> create index stid on student(sname);
Query OK, 0 rows affected (0.10 sec)
Records: 0  Duplicates: 0  Warnings: 0

mysql> show index from student;
+---------+------------+----------+--------------+-------------+-----------+-------------+----------+--------+------+------------+---------+---------------+
| Table   | Non_unique | Key_name | Seq_in_index | Column_name | Collation | Cardinality | Sub_part | Packed | Null | Index_type | Comment | Index_comment |
+---------+------------+----------+--------------+-------------+-----------+-------------+----------+--------+------+------------+---------+---------------+
| student |          0 | PRIMARY  |            1 | tid         | A         |           2 |     NULL | NULL   |      | BTREE      |         |               |
| student |          1 | stid     |            1 | sname       | A         |          10 |     NULL | NULL   | YES  | BTREE      |         |               |
+---------+------------+----------+--------------+-------------+-----------+-------------+----------+--------+------+------------+---------+---------------+
2 rows in set (0.01 sec)

mysql> # CREATE SEQUENCE
mysql> 
mysql> create table pern(
    -> tid int not null auto_increment, 
    -> sname varchar(20), 
    -> primary key(tid)
    -> );
Query OK, 0 rows affected (0.04 sec)

mysql> insert into pern(sname) values ('Anmol');
Query OK, 1 row affected (0.01 sec)

mysql> insert into pern(sname) values ('Anmo');
Query OK, 1 row affected (0.00 sec)

mysql> insert into pern(sname) values ('An');
Query OK, 1 row affected (0.01 sec)

mysql> delete from pern where tid = 3;
Query OK, 1 row affected (0.01 sec)

mysql> insert into pern(sname) values ('A');
Query OK, 1 row affected (0.03 sec)

mysql> select * from pern;
+-----+-------+
| tid | sname |
+-----+-------+
|   1 | Anmol |
|   2 | Anmo  |
|   4 | A     |
+-----+-------+
3 rows in set (0.00 sec)

mysql> 
mysql> # CREATE SYNONYM
mysql> 
mysql> select tid as notTid, sname from pern;
+--------+-------+
| notTid | sname |
+--------+-------+
|      1 | Anmol |
|      2 | Anmo  |
|      4 | A     |
+--------+-------+
3 rows in set (0.00 sec)

mysql> create view newPern as select tid as notTid, sname from pern;
Query OK, 0 rows affected (0.03 sec)

mysql> select * from newPern;
+--------+-------+
| notTid | sname |
+--------+-------+
|      1 | Anmol |
|      2 | Anmo  |
|      4 | A     |
+--------+-------+
3 rows in set (0.00 sec)

mysql> 
